{
	"domain": "classification",
	"methods": [
		{
			"algorithm": "svm",
			"hyperparameters": [
				{
					"param": "x1",
					"values": [2.5, -5, 10, 0.397887, -3.14159, 3.14159, 9.42478]
				},
				{
					"param": "x2",
					"values": [7.5, 0, 15, 12.275, 2.275, 2.475, 0.397887]
				}
			]
		}
	],
	"computationalResources": {
		"maxTotalInstances": 6
	},
	"emailAddress": "thanatos.dreamslayer@gmail.com"
}